{
  "saveId": "demo-farm",
  "sessionId": "echo-day-3",
  "snapshotVersion": 1,
  "day": 3,
  "timeOfDay": 620,
  "weather": "sunny",
  "location": "Farm",
  "playerPosition": {"x": 4, "y": 8},
  "energy": 260,
  "maxEnergy": 270,
  "inventory": {"freeSlots": 10, "items": []},
  "wateringCan": {"name": "Watering Can", "level": 1, "water": 0, "capacity": 40},
  "crops": [
    {"id":"crop-new-dry","position":{"x":22,"y":12},"kind":"parsnip","growthStage":2,"mature":false,"needsWater":true}
  ],
  "waterSources": [{"id":"pond-south","position":{"x":12,"y":14}}],
  "chests": [{"id":"shipping-chest","label":"shipping","position":{"x":3,"y":6}}],
  "obstacles": []
}
